{
  "schema": "rulelink_publication_expansion_backlog_v1",
  "schema_sha256": "6f29f9b5d87f6bfc56bc24e0c0d6358b0dd09cdec5044836cc53e6963e01ffb3",
  "snapshot_id": "kr-knowledge-core-20261025-025",
  "base_bundle_sha256": "6f62c78391c3aa622f08dcbf769471d8835edc0f6e1e8ff517384ab8d45b9173",
  "coverage_manifest_sha256": "6db5f10ab83fc5ffbeb353fd54d03725f7de4894f5aaa368118914077dda446f",
  "content_count": 284,
  "hub_count": 28,
  "summary": {
    "coverage_declared": 5,
    "coverage_unmapped": 279,
    "declared_incomplete": 5,
    "graph_ready_unmapped": 251,
    "structure_incomplete": 28,
    "verified_release": 0
  },
  "entries": [
    {
      "content_id": "content.2026-livelihood-account-protection",
      "content_revision_sha256": "f6b67dc2333e14397fefc62c5dfead69544820ccc12688380828973250f6bacb",
      "coverage_state": "unmapped",
      "coverage_unit_ids": [],
      "gap_codes": [
        "audience_situation_missing",
        "coverage_not_declared"
      ],
      "hub_ids": [
        "hub.debt-enforcement"
      ],
      "next_action": "complete_canonical_content_structure",
      "readiness_state": "structure_incomplete"
    },
    {
      "content_id": "content.2026-loss-of-inheritance-right-and-representation",
      "content_revision_sha256": "e5c1dbb02afd37fcb1b84870b5873acbe140cb5919701e6756098ee83d7606ad",
      "coverage_state": "unmapped",
      "coverage_unit_ids": [],
      "gap_codes": [
        "coverage_not_declared"
      ],
      "hub_ids": [
        "hub.family-inheritance"
      ],
      "next_action": "declare_coverage_and_evaluation_scope",
      "readiness_state": "graph_ready_unmapped"
    },
    {
      "content_id": "content.accident-damages-responsibility-map",
      "content_revision_sha256": "4d786824fcd825d9f807b26779192c58b1d14cc5ac89b7b739f3c3c666028842",
      "coverage_state": "unmapped",
      "coverage_unit_ids": [],
      "gap_codes": [
        "coverage_not_declared"
      ],
      "hub_ids": [
        "hub.everyday-damages"
      ],
      "next_action": "declare_coverage_and_evaluation_scope",
      "readiness_state": "graph_ready_unmapped"
    },
    {
      "content_id": "content.accident-evidence-and-tort-limitation",
      "content_revision_sha256": "f02f0988e2b73196eec408ab767086cc8af0ef827625e863db83eaf62a6eec39",
      "coverage_state": "unmapped",
      "coverage_unit_ids": [],
      "gap_codes": [
        "coverage_not_declared",
        "scenario_missing"
      ],
      "hub_ids": [
        "hub.everyday-damages"
      ],
      "next_action": "complete_canonical_content_structure",
      "readiness_state": "structure_incomplete"
    },
    {
      "content_id": "content.admin-appeal.application-preparation",
      "content_revision_sha256": "a36435f6e7c01bf6f0a7387460bff34d4ba600962507ae4d4034a63aa21f0230",
      "coverage_state": "unmapped",
      "coverage_unit_ids": [],
      "gap_codes": [
        "coverage_not_declared"
      ],
      "hub_ids": [
        "hub.administrative-appeals"
      ],
      "next_action": "declare_coverage_and_evaluation_scope",
      "readiness_state": "graph_ready_unmapped"
    },
    {
      "content_id": "content.admin-appeal.data-sharing-consent",
      "content_revision_sha256": "cdbab729e3f0155a0a480ce0677b097a9a9b219c5648a3ce7e931f8bd0ef64e0",
      "coverage_state": "unmapped",
      "coverage_unit_ids": [],
      "gap_codes": [
        "coverage_not_declared"
      ],
      "hub_ids": [
        "hub.administrative-appeals"
      ],
      "next_action": "declare_coverage_and_evaluation_scope",
      "readiness_state": "graph_ready_unmapped"
    },
    {
      "content_id": "content.admin-appeal.documents-law-change",
      "content_revision_sha256": "5be1f79aacd59d36ea70864327068cd9468e23a04ce04b3e65a55f9ae7a7227a",
      "coverage_state": "unmapped",
      "coverage_unit_ids": [],
      "gap_codes": [
        "coverage_not_declared"
      ],
      "hub_ids": [
        "hub.administrative-appeals"
      ],
      "next_action": "declare_coverage_and_evaluation_scope",
      "readiness_state": "graph_ready_unmapped"
    },
    {
      "content_id": "content.admin-appeal.eligibility-document-branch",
      "content_revision_sha256": "e6cebb4a57d7990b673e7380f51227b666d26394e5f7ee8bd902374cc7bf5b6e",
      "coverage_state": "unmapped",
      "coverage_unit_ids": [],
      "gap_codes": [
        "coverage_not_declared"
      ],
      "hub_ids": [
        "hub.administrative-appeals"
      ],
      "next_action": "declare_coverage_and_evaluation_scope",
      "readiness_state": "graph_ready_unmapped"
    },
    {
      "content_id": "content.admin-appeal.not-all-documents-waived",
      "content_revision_sha256": "4ef770205138f28b39e4642707ee0b1a812422a3295415f464bab0022ba18145",
      "coverage_state": "unmapped",
      "coverage_unit_ids": [],
      "gap_codes": [
        "coverage_not_declared"
      ],
      "hub_ids": [
        "hub.administrative-appeals"
      ],
      "next_action": "declare_coverage_and_evaluation_scope",
      "readiness_state": "graph_ready_unmapped"
    },
    {
      "content_id": "content.admin-appeal.qualification-vs-proof",
      "content_revision_sha256": "993bf42e276e9c6711860ea298f2671442c2674bb26ca1e95b6f1df946a0e3ef",
      "coverage_state": "unmapped",
      "coverage_unit_ids": [],
      "gap_codes": [
        "coverage_not_declared"
      ],
      "hub_ids": [
        "hub.administrative-appeals"
      ],
      "next_action": "declare_coverage_and_evaluation_scope",
      "readiness_state": "graph_ready_unmapped"
    },
    {
      "content_id": "content.administrative-appeal-suspension-vs-court-suspension",
      "content_revision_sha256": "b6414c29fa43b8cce2babdcd7a5bfd705c2cb6cebdfae727df8cc63b045c75a1",
      "coverage_state": "unmapped",
      "coverage_unit_ids": [],
      "gap_codes": [
        "coverage_not_declared"
      ],
      "hub_ids": [
        "hub.remedy-path-comparisons"
      ],
      "next_action": "declare_coverage_and_evaluation_scope",
      "readiness_state": "graph_ready_unmapped"
    },
    {
      "content_id": "content.administrative-appeal-vs-revocation-lawsuit",
      "content_revision_sha256": "1a5f6580cb96b9a60506c2df8c40b0bed720345eaddf9471e9e57890daa56e2a",
      "coverage_state": "unmapped",
      "coverage_unit_ids": [],
      "gap_codes": [
        "coverage_not_declared"
      ],
      "hub_ids": [
        "hub.remedy-path-comparisons"
      ],
      "next_action": "declare_coverage_and_evaluation_scope",
      "readiness_state": "graph_ready_unmapped"
    },
    {
      "content_id": "content.administrative-appeal-vs-revocation-suit-deadline",
      "content_revision_sha256": "84cc7981f3af9d6aa867d10432ff4dafd1a3c2e8d95c4c49833853618d39b8e7",
      "coverage_state": "unmapped",
      "coverage_unit_ids": [],
      "gap_codes": [
        "coverage_not_declared"
      ],
      "hub_ids": [
        "hub.deadline-and-timing-comparisons"
      ],
      "next_action": "declare_coverage_and_evaluation_scope",
      "readiness_state": "graph_ready_unmapped"
    },
    {
      "content_id": "content.asset-transfer-harming-property-division",
      "content_revision_sha256": "fe3c3dba5dd61f64369ffbfbbd800bd71236b4aa60c147f32d6b3c933b05f687",
      "coverage_state": "unmapped",
      "coverage_unit_ids": [],
      "gap_codes": [
        "coverage_not_declared"
      ],
      "hub_ids": [
        "hub.divorce-parenting"
      ],
      "next_action": "declare_coverage_and_evaluation_scope",
      "readiness_state": "graph_ready_unmapped"
    },
    {
      "content_id": "content.attorney-advertising-and-selection",
      "content_revision_sha256": "2d74ab8550b926601f0966229fddc4a99abe58b9529a90066aead2f133193533",
      "coverage_state": "unmapped",
      "coverage_unit_ids": [],
      "gap_codes": [
        "coverage_not_declared"
      ],
      "hub_ids": [
        "hub.legal-service-boundaries"
      ],
      "next_action": "declare_coverage_and_evaluation_scope",
      "readiness_state": "graph_ready_unmapped"
    },
    {
      "content_id": "content.auto-accident-insurance-comprehensive-insurance-criminal",
      "content_revision_sha256": "29bef27181408754244f1543312e8fed6ff0c020600f14d0db2c08ec56123397",
      "coverage_state": "unmapped",
      "coverage_unit_ids": [],
      "gap_codes": [
        "coverage_not_declared"
      ],
      "hub_ids": [
        "hub.auto-accident-insurance"
      ],
      "next_action": "declare_coverage_and_evaluation_scope",
      "readiness_state": "graph_ready_unmapped"
    },
    {
      "content_id": "content.auto-accident-insurance-direct-insurance-claim",
      "content_revision_sha256": "f429d256a5803cb16fdff7bae61e2350635699f976443582537bb4b655061d25",
      "coverage_state": "unmapped",
      "coverage_unit_ids": [],
      "gap_codes": [
        "coverage_not_declared"
      ],
      "hub_ids": [
        "hub.auto-accident-insurance"
      ],
      "next_action": "declare_coverage_and_evaluation_scope",
      "readiness_state": "graph_ready_unmapped"
    },
    {
      "content_id": "content.auto-accident-insurance-evidence-and-treatment",
      "content_revision_sha256": "c6f289559542e1158538fdf0ed18d502ef92f616c12716af6448b596e9443beb",
      "coverage_state": "unmapped",
      "coverage_unit_ids": [],
      "gap_codes": [
        "coverage_not_declared"
      ],
      "hub_ids": [
        "hub.auto-accident-insurance"
      ],
      "next_action": "declare_coverage_and_evaluation_scope",
      "readiness_state": "graph_ready_unmapped"
    },
    {
      "content_id": "content.auto-accident-insurance-immediate-response",
      "content_revision_sha256": "638d350c75664cc70d78a1de30b7800d10ca3556b4c5d8495ee2b5985fe2a331",
      "coverage_state": "unmapped",
      "coverage_unit_ids": [],
      "gap_codes": [
        "coverage_not_declared"
      ],
      "hub_ids": [
        "hub.auto-accident-insurance"
      ],
      "next_action": "declare_coverage_and_evaluation_scope",